{
  "$schema": "./schema.json",
  "schemaVersion": 1,
  "policy": {
    "code": "wave-1-baseline-v1"
  },
  "workspaces": [
    { "path": "apps/plugin/opencode2", "name": "@iamsterling/opencode2-config", "kind": "plugin", "private": false },
    { "path": "apps/runtime", "name": "@curiosity/runtime", "kind": "runtime", "private": true },
    { "path": "apps/web", "name": "web", "kind": "starter-app", "private": true },
    { "path": "apps/docs", "name": "docs", "kind": "starter-app", "private": true },
    { "path": "packages/ui", "name": "@repo/ui", "kind": "starter-library", "private": true },
    { "path": "packages/eslint-config", "name": "@repo/eslint-config", "kind": "configuration", "private": true },
    { "path": "packages/typescript-config", "name": "@repo/typescript-config", "kind": "configuration", "private": true }
  ],
  "sourceContracts": {
    "composition": {
      "path": "apps/plugin/opencode2/src/plugin/plugin.ts",
      "features": ["pluginConfigFeature", "hookFoundationFeature", "structuredToolsFeature"],
      "entryExport": "apps/plugin/opencode2/src/index.ts#default"
    },
    "exports": {
      "path": "apps/plugin/opencode2/package.json",
      "keys": [".", "./server"]
    },
    "capabilityReport": {
      "path": "apps/plugin/opencode2/src/platform/real-host/index.ts",
      "export": "capabilityReport",
      "pinnedVersion": "0.0.0-beta-17595",
      "capabilities": {
        "reload": { "status": "disabled", "code": "REAL_HOST_RELOAD_UNPROVEN" },
        "interrupt": { "status": "disabled", "code": "REAL_HOST_INTERRUPT_UNPROVEN" },
        "compaction": { "status": "disabled", "code": "REAL_HOST_COMPACTION_UNSUPPORTED" },
        "childLineage": { "status": "disabled", "code": "REAL_HOST_CHILD_LINEAGE_UNSUPPORTED" },
        "concurrentSetup": { "status": "disabled", "code": "REAL_HOST_WRITER_ELECTION_UNPROVEN" },
        "authoritativePersistence": { "status": "disabled", "code": "PERSISTENCE_AUTOMATION_UNSUPPORTED" }
      }
    },
    "adrIndexes": [
      {
        "path": "apps/plugin/opencode2/docs/architecture/README.md",
        "required": [
          "0029-controlled-phase-core-concurrency-companion.md",
          "0030-closed-sdk-v2-tool-policy-companion.md",
          "0031-registry-ready-package-and-black-box-proof.md"
        ]
      },
      {
        "path": "apps/runtime/docs/README.md",
        "required": ["0060-closed-sdk-v2-tool-and-environment-policy.md"]
      }
    ],
    "historicalSnapshots": [
      {
        "path": "apps/plugin/opencode2/docs/architecture/preflight-2026-08-12.md",
        "classification": "immutable-historical",
        "authority": "not-current",
        "historyRule": "fixed-baseline-index-blob"
      }
    ],
    "retiredSurfaces": [
      "apps/plugin/opencode2/src/features/loop-compat",
      "apps/plugin/opencode2/tools/loopd.mjs",
      "apps/plugin/opencode2/tools/state-tool.mjs",
      "apps/plugin/opencode2/assets/agents/opencode-loop-local.md"
    ],
    "forbiddenProductPatterns": [
      {
        "roots": ["apps/plugin/opencode2/src", "apps/plugin/opencode2/assets"],
        "patterns": ["opencode-loop-local", "\\[opencode-loop:"]
      }
    ],
    "guardedSources": [
      { "path": "package.json", "sha256": "ab5d5a9763a3553268da2e35aa2365f4c8f6d9458e4608eafa64f2e2c73660db" },
      { "path": "apps/plugin/opencode2/package.json", "sha256": "2086e8d9003ad7205eba3fbb34688dd47813e4663f63e848bfd7e0e5cdeafddc" },
      { "path": "apps/plugin/opencode2/src/index.ts", "sha256": "5e352d675e5d12f80fbc31bd38e3ae28f2a0c5d5e1de33e8fc5078d5bc9f9a65" },
      { "path": "apps/plugin/opencode2/src/plugin/plugin.ts", "sha256": "e1349089fd24623accdfc3def40e3fa6ff11eb2a30b14d450fc8d81bf03d43fb" },
      { "path": "apps/plugin/opencode2/src/platform/real-host/index.ts", "sha256": "2314f93021c0ecad109f2ea88c427abd1709b2277e147ef75557f2831d340ceb" },
      { "path": "apps/runtime/package.json", "sha256": "05914daf80e02fd5c799c01868f23f8eb967b12f92b20bf4660e7ab2048e8d73" },
      { "path": "apps/runtime/src/index.ts", "sha256": "07e4bbc710ded0bdcb315dced648771e5dae6150328f8ecae5acce5fac7ba664" },
      { "path": "apps/runtime/src/query.ts", "sha256": "f610ffd47f69ec751d9cf73fa0d33879e027dea64ed4fc56378938ce72418808" },
      { "path": "apps/runtime/src/admin.ts", "sha256": "839b16ffed0d13cfcdbbdfbc2f6bc112591c37e2d192f6bb7108be150e1b0db4" }
    ]
  },
  "capabilities": [
    {
      "id": "plugin-identity-config",
      "owners": ["plugin"],
      "scope": { "product": "plugin", "level": "package", "environments": ["repository", "development"], "platforms": [], "constraints": ["OpenCode beta-17595 ABI"] },
      "observation": { "state": "implemented", "refs": [{ "kind": "source", "ref": "apps/plugin/opencode2/src/plugin/plugin.ts#promisePlugin" }, { "kind": "source", "ref": "apps/plugin/opencode2/src/features/config/index.ts#pluginConfigFeature" }] },
      "assertion": { "state": "positive", "code": "validated-positive", "refs": [{ "kind": "test", "ref": "apps/plugin/opencode2/tests/integration/plugin-setup.test.mjs#setup installs the bundled agent suite and selects orchestrator without user config" }] },
      "evidence": { "state": "sufficient", "refs": [{ "kind": "test", "ref": "apps/plugin/opencode2/tests/unit/plugin-entrypoint.test.mjs#entrypoint exports the default Effect plugin with a compatibility setup seam" }] },
      "authority": { "state": "authorized", "refs": [{ "kind": "decision", "ref": "apps/plugin/opencode2/docs/decisions/0005-product-identity.md#Product identity and peer boundaries" }] },
      "delivery": { "state": "composed", "refs": [{ "kind": "source", "ref": "apps/plugin/opencode2/src/plugin/plugin.ts#composed" }] },
      "qualification": { "state": "qualified", "platforms": [], "refs": [{ "kind": "test", "ref": "apps/plugin/opencode2/tests/integration/plugin-setup.test.mjs#setup accepts the reviewed beta-17595 host ABI" }] },
      "availability": { "state": "enabled", "environments": ["repository", "development"], "production": "disabled", "publication": "unknown", "deployment": "disabled" },
      "status": "Current",
      "verdict": { "decision": "GO", "rationaleCode": "scope-qualified-current" },
      "blockerCodes": [],
      "guards": [{"path":"apps/plugin/opencode2/src/features/config/index.ts","mode":"exact","sha256":"2342f5f1e6461a6eb0e55138c06b2ebf0e62e5e56368081cfa0ad02ad9bd404e"},{"path":"apps/plugin/opencode2/src/plugin/plugin.ts","mode":"exact","sha256":"e1349089fd24623accdfc3def40e3fa6ff11eb2a30b14d450fc8d81bf03d43fb"},{"path":"apps/plugin/opencode2/tests/integration/plugin-setup.test.mjs","mode":"exact","sha256":"7d2a84dd9828412acfd1f094993dfb91cf070f83b126b37e53bc687d759ce305"},{"path":"apps/plugin/opencode2/tests/unit/plugin-entrypoint.test.mjs","mode":"exact","sha256":"484649da7f999e28b6d0178e3171b01017d2e91355db2e2631cbf0947a02a5c9"},{"path":"apps/plugin/opencode2/docs/decisions/0005-product-identity.md","mode":"exact","sha256":"aabe7c6ba42730f18644900c5a3356ab23e841d8ec7ee2b9d85f26befa268a3e"}]
    },
    {
      "id": "plugin-hooks-event-capture",
      "owners": ["plugin"],
      "scope": { "product": "plugin", "level": "package", "environments": ["repository", "development"], "platforms": [], "constraints": ["observation-only event capture", "redacted payloads"] },
      "observation": { "state": "implemented", "refs": [{ "kind": "source", "ref": "apps/plugin/opencode2/src/features/hooks/open-code-hooks.ts#registerOpenCodeHooks" }, { "kind": "source", "ref": "apps/plugin/opencode2/src/features/hooks/event-capture.ts#EventCapture" }] },
      "assertion": { "state": "limited", "code": "scope-limited", "refs": [{ "kind": "section", "ref": "apps/plugin/opencode2/docs/architecture/current-state.md#Composed plugin scope" }] },
      "evidence": { "state": "sufficient", "refs": [{ "kind": "test", "ref": "apps/plugin/opencode2/tests/unit/event-capture.test.mjs#capture is idempotent and records sequence gaps and collisions" }] },
      "authority": { "state": "authorized", "refs": [{ "kind": "decision", "ref": "apps/plugin/opencode2/docs/decisions/0012-ledger-native-product.md#ADR 0012 Ledger authority and native loop product" }] },
      "delivery": { "state": "composed", "refs": [{ "kind": "source", "ref": "apps/plugin/opencode2/src/features/hooks/index.ts#hookFoundationFeature" }] },
      "qualification": { "state": "qualified", "platforms": [], "refs": [{ "kind": "test", "ref": "apps/plugin/opencode2/tests/integration/plugin-setup.test.mjs#setup registers functional Promise hooks and every product tool once" }] },
      "availability": { "state": "observation-only", "environments": ["repository", "development"], "production": "disabled", "publication": "unknown", "deployment": "disabled" },
      "status": "Current",
      "verdict": { "decision": "GO", "rationaleCode": "scope-qualified-current" },
      "blockerCodes": [],
      "guards": [{"path":"apps/plugin/opencode2/src/features/hooks/event-capture.ts","mode":"exact","sha256":"1af843b7ede004cb855c5567d7416033684e4ffa1f05abac33070642e322c80c"},{"path":"apps/plugin/opencode2/src/features/hooks/open-code-hooks.ts","mode":"exact","sha256":"1ede1d60809c4a7396be037c5d799f1c91ab57e5385b3ceb406af6236aef34e9"},{"path":"apps/plugin/opencode2/tests/unit/event-capture.test.mjs","mode":"exact","sha256":"3e5abf01d16762406ba8c77776032c22950fc3e334b82d9d91f7b0db0d15e933"},{"path":"apps/plugin/opencode2/docs/decisions/0012-ledger-native-product.md","mode":"exact","sha256":"63f31dda664ea883c04d8974aec902d75638a3a24892e6933e45b4a67fe16ef7"},{"path":"apps/plugin/opencode2/src/features/hooks/index.ts","mode":"exact","sha256":"61fcb7734b62a1f58772d6841acdec709a83dfb17259b65c5277a00143a6f39c"},{"path":"apps/plugin/opencode2/tests/integration/plugin-setup.test.mjs","mode":"exact","sha256":"7d2a84dd9828412acfd1f094993dfb91cf070f83b126b37e53bc687d759ce305"}]
    },
    {
      "id": "plugin-structured-tools",
      "owners": ["plugin"],